{
"baseURL": "https://example.org/",
"language": "en",
"root": {
"children": [
{
"children": [
{
"description": "Write notes, warnings and collapsible asides — with colour, icon and title — as `\u003e [!NOTE]` blockquotes, no shortcode involved.",
"id": "/docs/callout/",
"kind": "page",
"markdown": "https://example.org/docs/callout/index.md",
"title": "Callouts",
"url": "https://example.org/docs/callout/"
},
{
"description": "Plain Markdown image syntax plus one attribute line gives you captions, sizing, zoom, links, numbering and Hugo image processing.",
"id": "/docs/image/",
"kind": "page",
"markdown": "https://example.org/docs/image/index.md",
"title": "Images",
"url": "https://example.org/docs/image/"
},
{
"description": "A plain Markdown fence plus one attribute line gives you a filename title, exact copy, line numbers, highlighting, wrapping, folding and linkable lines.",
"id": "/docs/code/",
"kind": "page",
"markdown": "https://example.org/docs/code/index.md",
"title": "Code blocks",
"url": "https://example.org/docs/code/"
},
{
"description": "A `{tab=}` attribute on adjacent fences or tables makes a tab set; add a group and it becomes linkable, synchronized and remembered.",
"id": "/docs/tabs/",
"kind": "page",
"markdown": "https://example.org/docs/tabs/index.md",
"title": "Tabs",
"url": "https://example.org/docs/tabs/"
},
{
"description": "A plain GFM table plus one attribute line becomes a captioned table, a compatibility matrix, a field list, a numbered table or a tab set; wide tables scroll on their own.",
"id": "/docs/table/",
"kind": "page",
"markdown": "https://example.org/docs/table/index.md",
"title": "Tables",
"url": "https://example.org/docs/table/"
},
{
"description": "A plain table plus `{.fields}` documents configuration keys, command flags and API fields — name, type, default and description each in place, readable on a narrow screen, every entry individually linkable.",
"id": "/docs/fields/",
"kind": "page",
"markdown": "https://example.org/docs/fields/index.md",
"title": "Fields",
"url": "https://example.org/docs/fields/"
},
{
"description": "An ordered list plus `{.steps}` becomes a numbered procedure with dots and a connecting rule; switch to the steps shortcode when each step needs a heading in the table of contents.",
"id": "/docs/steps/",
"kind": "page",
"markdown": "https://example.org/docs/steps/index.md",
"title": "Steps",
"url": "https://example.org/docs/steps/"
},
{
"description": "A link list plus `{.cards}` lays out a grid of navigation cards; switch to the shortcode when you need icons, badges or images.",
"id": "/docs/cards/",
"kind": "page",
"markdown": "https://example.org/docs/cards/index.md",
"title": "Cards",
"url": "https://example.org/docs/cards/"
},
{
"description": "A `filetree` fence draws an annotated directory structure — aligned comment column, per-entry icons, collapsible directories, a draggable split.",
"id": "/docs/filetree/",
"kind": "page",
"markdown": "https://example.org/docs/filetree/index.md",
"title": "File trees",
"url": "https://example.org/docs/filetree/"
},
{
"description": "Inline and display mathematics with KaTeX, rendered at build time — the reader downloads no script.",
"id": "/docs/math/",
"kind": "page",
"markdown": "https://example.org/docs/math/index.md",
"title": "Mathematics",
"url": "https://example.org/docs/math/"
},
{
"description": "A `mermaid` fence turns text into flowcharts, sequence diagrams, Gantt charts, class diagrams and state diagrams — rendered locally, theme-aware, diff-friendly.",
"id": "/docs/mermaid/",
"kind": "page",
"markdown": "https://example.org/docs/mermaid/index.md",
"title": "Mermaid",
"url": "https://example.org/docs/mermaid/"
},
{
"description": "A `plantuml` fence writes sequence, class, component, activity and use-case diagrams; rendering requires a PlantUML server you configure yourself.",
"id": "/docs/plantuml/",
"kind": "page",
"markdown": "https://example.org/docs/plantuml/index.md",
"title": "PlantUML",
"url": "https://example.org/docs/plantuml/"
},
{
"description": "A `markmap` fence turns a Markdown outline into an expandable, zoomable mind map — and the source stays a readable outline.",
"id": "/docs/markmap/",
"kind": "page",
"markdown": "https://example.org/docs/markmap/index.md",
"title": "Markmap",
"url": "https://example.org/docs/markmap/"
},
{
"description": "Put a `.drawio.svg` that carries an editable copy on the page as an ordinary image; hovering gives the reader a button that opens the Draw.io editor.",
"id": "/docs/drawio/",
"kind": "page",
"markdown": "https://example.org/docs/drawio/index.md",
"title": "Draw.io",
"url": "https://example.org/docs/drawio/"
},
{
"description": "Write ECharts options as YAML or JSON in an `echarts` fence; Hugo validates them at build time and the browser draws a theme-aware chart with the local ECharts.",
"id": "/docs/echarts/",
"kind": "page",
"markdown": "https://example.org/docs/echarts/index.md",
"title": "ECharts",
"url": "https://example.org/docs/echarts/"
},
{
"description": "An `infographic` fence picks an AntV template and renders a title plus a list of items as a flow, timeline, funnel, grid or hierarchy.",
"id": "/docs/infographic/",
"kind": "page",
"markdown": "https://example.org/docs/infographic/index.md",
"title": "Infographic",
"url": "https://example.org/docs/infographic/"
},
{
"description": "A `gallery` fence arranges related screenshots in a responsive grid, each with an optional description or link, reusing the page's image zoom dialog.",
"id": "/docs/gallery/",
"kind": "page",
"markdown": "https://example.org/docs/gallery/index.md",
"title": "Galleries",
"url": "https://example.org/docs/gallery/"
},
{
"description": "Put a semantic status label next to a feature name, a version or a table cell — five tones, no custom colours.",
"id": "/docs/badge/",
"kind": "page",
"markdown": "https://example.org/docs/badge/index.md",
"title": "Badges",
"url": "https://example.org/docs/badge/"
},
{
"description": "Write shortcuts with `kbd` — one shortcode, a list of key names, a semantic key sequence that stays readable in print and in Markdown output.",
"id": "/docs/kbd/",
"kind": "page",
"markdown": "https://example.org/docs/kbd/index.md",
"title": "Keys",
"url": "https://example.org/docs/kbd/"
},
{
"description": "Pull an external file in with include, print a site parameter with param, and write a note that reaches no output at all with comment.",
"id": "/docs/include/",
"kind": "page",
"markdown": "https://example.org/docs/include/index.md",
"title": "Include",
"url": "https://example.org/docs/include/"
},
{
"description": "Put a .cast terminal recording on the page — the text stays selectable text, and the player ships with the theme rather than coming from a CDN.",
"id": "/docs/asciinema/",
"kind": "page",
"markdown": "https://example.org/docs/asciinema/index.md",
"title": "Asciinema",
"url": "https://example.org/docs/asciinema/"
}
],
"description": "Markdown Component Examples",
"id": "/docs/",
"kind": "section",
"markdown": "https://example.org/docs/index.md",
"title": "Docs",
"url": "https://example.org/docs/"
},
{
"children": [
{
"description": "A compact fixture for long-form reading and CJK fallback.",
"id": "/blog/typography/",
"kind": "page",
"markdown": "https://example.org/blog/typography/index.md",
"title": "A typography regression article",
"url": "https://example.org/blog/typography/"
},
{
"children": [
{
"description": "Four front-matter keys turn a blog page into a reading-first layout: a hero drawn from the featured image, no chrome but the outline rail, and every blog component in its usual place below the fold.",
"id": "/blog/oink/immersive-reading/",
"kind": "page",
"markdown": "https://example.org/blog/oink/immersive-reading/index.md",
"title": "Immersive reading",
"url": "https://example.org/blog/oink/immersive-reading/"
},
{
"description": "OINK turns a directly customized Docsy codebase into a local-first, Hugo-only documentation theme with multilingual infrastructure and reusable content components.",
"id": "/blog/oink/oink-announcement/",
"kind": "page",
"markdown": "https://example.org/blog/oink/oink-announcement/index.md",
"title": "Introducing OINK",
"url": "https://example.org/blog/oink/oink-announcement/"
},
{
"description": "A technical diary of the decisions, migrations, safety boundaries, tests, and documentation work behind the OINK implementation preview.",
"id": "/blog/oink/oink-implementation-diary/",
"kind": "page",
"markdown": "https://example.org/blog/oink/oink-implementation-diary/index.md",
"title": "OINK implementation diary",
"url": "https://example.org/blog/oink/oink-implementation-diary/"
}
],
"description": "OINK announcements, engineering stories, and implementation notes",
"id": "/blog/oink/",
"kind": "section",
"markdown": "https://example.org/blog/oink/index.md",
"title": "Oink",
"url": "https://example.org/blog/oink/"
},
{
"description": "A second entry that fixes the blog pager's chronological behavior.",
"id": "/blog/older/",
"kind": "page",
"markdown": "https://example.org/blog/older/index.md",
"title": "An older regression article",
"url": "https://example.org/blog/older/"
},
{
"description": "The 0.4 `author` string, including the Markdown block form.",
"id": "/blog/legacy-byline/",
"kind": "page",
"markdown": "https://example.org/blog/legacy-byline/index.md",
"title": "A legacy byline article",
"url": "https://example.org/blog/legacy-byline/"
},
{
"children": [
{
"description": "An older semantic version with a deliberately lower weight.",
"id": "/blog/release/pig-1.9.0/",
"kind": "page",
"markdown": "https://example.org/blog/release/pig-1.9.0/index.md",
"title": "Pig 1.9.0",
"url": "https://example.org/blog/release/pig-1.9.0/"
},
{
"description": "One GitHub release URL is the whole release input.",
"id": "/blog/release/shorthand/",
"kind": "page",
"markdown": "https://example.org/blog/release/shorthand/index.md",
"title": "A release URL alone",